{"type":"config","name":"Optimize usecli startup/config/command discovery speed","metricName":"startup_ms","metricUnit":"ms","bestDirection":"lower"}
{"run":1,"commit":"ea170b7","metric":0,"metrics":{},"status":"crash","description":"Baseline benchmark setup crashed during self startup subprocess","timestamp":1781312814645,"segment":0,"confidence":null,"asi":{"hypothesis":"Establish baseline for usecli startup/config/command discovery including self and dependency scenarios.","rollback_reason":"Benchmark script failed before baseline due to subprocess error; need inspect stderr and adjust benchmark setup rather than code optimization.","next_action_hint":"Run the self_code subprocess manually with stderr visible; likely Python 3.14/Typer compatibility or dependency mismatch in local environment."}}
{"run":2,"commit":"52562f2","metric":68.557,"metrics":{"self_ms":138.063,"dependency_ms":68.147,"config_ms":68.557},"status":"keep","description":"Baseline benchmark after using project uv environment for dependencies","timestamp":1781312832729,"segment":0,"confidence":null,"asi":{"hypothesis":"Measure representative CLI startup with dependencies available via uv run; this establishes baseline for config and command discovery speed.","benchmark_note":"Previous crash was benchmark environment only: plain python lacked simple-term-menu; measure.sh now launches outer harness through uv run python."}}
{"run":3,"commit":"4273102","metric":67.025,"metrics":{"self_ms":134.392,"dependency_ms":67.025,"config_ms":66.688},"status":"keep","description":"Lazy console-script alias discovery during config matching","timestamp":1781312884132,"segment":0,"confidence":null,"asi":{"hypothesis":"Avoid importlib.metadata.distributions() on the common path where config command_name exactly matches argv[0]; only compute aliases for mismatched configs that might be valid aliases.","result":"Small improvement across all startup scenarios; preserves alias behavior by lazily falling back to metadata lookup only when needed."}}
{"run":4,"commit":"4273102","metric":67.224,"metrics":{"self_ms":99.689,"dependency_ms":66.972,"config_ms":67.224},"status":"discard","description":"Cache get_config by unchanged cwd to avoid repeated root detection","timestamp":1781312915668,"segment":0,"confidence":336.80904522613395,"asi":{"hypothesis":"Repeated get_config calls during one process can skip find_project_root when cwd is unchanged.","rollback_reason":"Primary startup_ms was slightly worse than best despite large self_ms improvement; dependency/config medians dominate the primary benchmark and did not improve.","next_action_hint":"Reconsider with a primary metric that weights self startup, or combine this cache with changes that reduce dependency/config paths before retesting."}}
{"run":5,"commit":"4273102","metric":67.221,"metrics":{"self_ms":134.22,"dependency_ms":67.164,"config_ms":67.221},"status":"checks_failed","description":"Iterate module __dict__ instead of inspect.getmembers for command class discovery","timestamp":1781312935287,"segment":0,"confidence":673.6180904522679,"asi":{"hypothesis":"Avoid sorting and tuple creation from inspect.getmembers while loading many command modules.","rollback_reason":"Focused tests patch inspect.getmembers with MagicMock modules; direct __dict__ iteration encountered MagicMock sentinel values and failed test assumptions. Primary also did not improve.","next_action_hint":"If revisiting, guard with `vars(module)` only for real ModuleType and fallback to inspect.getmembers for non-module mocks, or update tests intentionally if behavior change is desired."}}
{"run":6,"commit":"4273102","metric":67.608,"metrics":{"self_ms":134.082,"dependency_ms":67.195,"config_ms":67.608},"status":"discard","description":"Fast __dict__ command member iteration for real modules with test fallback","timestamp":1781312951106,"segment":0,"confidence":336.80904522613395,"asi":{"hypothesis":"Use module.__dict__.values for real imported command modules to avoid inspect.getmembers sorting overhead, while retaining inspect fallback for mocked tests.","rollback_reason":"Checks passed but primary startup_ms regressed; overhead is not important relative to subprocess/import/config costs or variance.","next_action_hint":"Focus on config discovery/import-time dependency costs instead of command class member enumeration."}}
{"run":7,"commit":"4273102","metric":67.894,"metrics":{"self_ms":133.917,"dependency_ms":67.894,"config_ms":67.452},"status":"discard","description":"Cache parsed pyproject data inside ConfigManager","timestamp":1781312980903,"segment":0,"confidence":228.75426621161023,"asi":{"hypothesis":"Avoid parsing pyproject.toml twice during startup for version and direct-dependency checks.","rollback_reason":"Primary startup_ms regressed; pyproject parsing is not a measurable bottleneck in this workload or added method overhead offsets savings.","next_action_hint":"Look for import-time heavy modules or avoid unnecessary recursive config scans rather than pyproject parse caching."}}
{"run":8,"commit":"4273102","metric":0,"metrics":{"self_ms":0,"dependency_ms":0,"config_ms":0},"status":"crash","description":"Lazy usecli.cli.core package exports to reduce eager Rich/validator imports","timestamp":1781313026732,"segment":0,"confidence":228.75426621161023,"asi":{"hypothesis":"Parent package usecli.cli.core is imported before base_command, so removing eager imports of error handlers, validators, and UI aliases should reduce startup import cost.","rollback_reason":"Benchmark crashed during self startup; stderr not included in benchmark output, so the compatibility issue needs manual reproduction after revert if revisited.","next_action_hint":"Reapply cautiously and run `PYTHONPATH=src uv run python -c 'import sys; sys.argv=[\"usecli\"]; import usecli'` with stderr visible. Likely some code imports deprecated aliases such as usecli.cli.core.ui/list/title through package init."}}
{"run":9,"commit":"4273102","metric":67.963,"metrics":{"self_ms":133.582,"dependency_ms":66.948,"config_ms":67.963},"status":"discard","description":"Lazy import terminal_menu inside Menu methods","timestamp":1781313049919,"segment":0,"confidence":174.5442708333332,"asi":{"hypothesis":"Avoid importing simple-term-menu during normal CLI startup unless Menu is actually used interactively.","rollback_reason":"Primary startup_ms regressed; simple-term-menu import is not dominant in current uv environment or saved work is hidden by other import costs/noise.","next_action_hint":"Larger import-time wins likely require reducing core package/Rich/Jinja imports or avoiding loading hidden init/make commands, not just menu utility laziness."}}
{"run":10,"commit":"76ebb4d","metric":64.822,"metrics":{"self_ms":132.186,"dependency_ms":64.659,"config_ms":64.822},"status":"keep","description":"Skip usecli-only init command import for downstream CLIs","timestamp":1781313075547,"segment":0,"confidence":149.1875719217492,"asi":{"hypothesis":"Downstream CLIs should not import/register `init_command.py`, which is only visible for the `usecli` executable and pulls heavy scaffolding dependencies like Jinja/Rich prompts/pyfiglet.","result":"Substantial dependency startup win while preserving self usecli behavior and focused tests; avoids loading a hidden command instead of changing discovery semantics."}}
{"run":11,"commit":"41c32a3","metric":58.934,"metrics":{"self_ms":135.381,"dependency_ms":57.873,"config_ms":58.934},"status":"keep","description":"Skip usecli-only make command modules for downstream CLIs","timestamp":1781313099244,"segment":0,"confidence":87.96119402985052,"asi":{"hypothesis":"`make:command` and `make:theme` are visible only for the `usecli` executable but are still imported by downstream CLIs, pulling Jinja/caseconverter/Rich scaffolding dependencies.","result":"Large dependency/config startup improvement by avoiding hidden usecli-only command module imports for non-usecli argv[0]; self usecli still loads them."}}
{"run":12,"commit":"41c32a3","metric":59.719,"metrics":{"self_ms":136.709,"dependency_ms":59.719,"config_ms":58.142},"status":"discard","description":"Hoist usecli-only command-name check out of command file loop","timestamp":1781313128158,"segment":0,"confidence":83.47592067988631,"asi":{"hypothesis":"Avoid recomputing Path(sys.argv[0]).name for every discovered command file.","rollback_reason":"Primary startup_ms regressed versus best; micro-optimization is lost in noise and may not affect real file/import bottlenecks.","next_action_hint":"Focus on reducing modules imported, not per-file condition overhead."}}
{"run":13,"commit":"ab07dbe","metric":58.536,"metrics":{"self_ms":138.168,"dependency_ms":58.06,"config_ms":58.536},"status":"keep","description":"Avoid eager inspect import and use direct class checks for real command modules","timestamp":1781313151237,"segment":0,"confidence":78.88948787062098,"asi":{"hypothesis":"Real imported command modules can be scanned via their __dict__ with isinstance(obj, type), avoiding eager inspect import and inspect.getmembers sorting; keep inspect only for test/mock fallback.","result":"Small primary improvement driven by dependency/config path; self usecli startup worsened slightly, so monitor future changes."}}
{"run":14,"commit":"05971e1","metric":57.474,"metrics":{"self_ms":135.217,"dependency_ms":57.474,"config_ms":57.301},"status":"keep","description":"Defer about command metadata/platform/toml imports until invoked","timestamp":1781313235680,"segment":0,"confidence":50.54881266490794,"asi":{"hypothesis":"The default about command should be registered at startup but expensive support imports for rendering about output (importlib.metadata, platform, re, tomllib helpers) can wait until the command is actually invoked.","result":"Improved dependency startup without changing visible command set; about command behavior remains lazy-correct under tests."}}
{"run":15,"commit":"58e378c","metric":56.418,"metrics":{"self_ms":134.393,"dependency_ms":56.366,"config_ms":56.418},"status":"keep","description":"Lazy core/ui package exports and config exception import to cut eager startup imports","timestamp":1781313305411,"segment":0,"confidence":36.82637075718024,"asi":{"hypothesis":"Importing `usecli.cli.core.base_command` was forcing core/ui package initializers to import error handlers, validators, list rendering, and Rich; lazy package exports plus lazy UsecliConfigError import should avoid that on normal startup.","result":"Primary improved; also fixed the circular import introduced by lazy core exports by making ui package exports and manager's config exception import lazy."}}
{"run":16,"commit":"58e378c","metric":56.731,"metrics":{"self_ms":134.917,"dependency_ms":56.618,"config_ms":56.731},"status":"checks_failed","description":"Lazy import importlib.metadata in ConfigManager","timestamp":1781313358047,"segment":0,"confidence":24.14637277979891,"asi":{"hypothesis":"Pure config discovery does not need importlib.metadata on exact local config matches, so defer metadata imports to console-script/package fallback paths.","rollback_reason":"Local `import importlib.metadata` inside methods shadowed the global `importlib` package name, causing UnboundLocalError at earlier `importlib.util.find_spec` references.","next_action_hint":"Retry using `from importlib import metadata` inside methods (or alias metadata) instead of `import importlib.metadata`."}}
{"run":17,"commit":"58e378c","metric":59.064,"metrics":{"self_ms":134.37,"dependency_ms":56.596,"config_ms":59.064},"status":"discard","description":"Lazy import importlib.metadata in ConfigManager using metadata alias","timestamp":1781313383680,"segment":0,"confidence":15.10522088353414,"asi":{"hypothesis":"Defer importlib.metadata when config lookup finds an exact local usecli.config.toml and does not need package/console-script metadata.","rollback_reason":"Checks passed but primary regressed; command_service still imports importlib.metadata for version lookup, and local import overhead may hurt fallback paths.","next_action_hint":"If reducing metadata import, target CommandService._load_version or avoid package metadata version lookup in hot paths instead."}}
{"run":18,"commit":"58e378c","metric":56.954,"metrics":{"self_ms":134.254,"dependency_ms":56.658,"config_ms":56.954},"status":"checks_failed","description":"Move command_service importlib.metadata version imports into _load_version","timestamp":1781313407894,"segment":0,"confidence":11.392972536348937,"asi":{"hypothesis":"Most benchmark projects provide a project version, so command_service can avoid importing importlib.metadata at module import time and only load it when package metadata fallback is needed.","rollback_reason":"Tests patch `usecli.cli.services.command_service.get_version`; removing the module-level symbol broke those tests.","next_action_hint":"Retry with a lightweight module-level `get_version()` wrapper that lazily imports `importlib.metadata.version`, and catch PackageNotFoundError by exception class name to avoid top-level metadata import."}}
{"run":19,"commit":"9cbc793","metric":56.371,"metrics":{"self_ms":134.627,"dependency_ms":56.181,"config_ms":56.371},"status":"keep","description":"Lazy get_version wrapper in command_service to avoid metadata import when project version exists","timestamp":1781313426457,"segment":0,"confidence":16.83721624850658,"asi":{"hypothesis":"Keep the test-patchable `get_version` symbol but make it a lazy wrapper so command_service module import avoids importlib.metadata unless package metadata fallback is actually needed.","result":"Small primary improvement with checks passing; preserves PackageNotFoundError fallback semantics by detecting the exception class name and re-raising unexpected errors."}}
{"run":20,"commit":"9cbc793","metric":56.733,"metrics":{"self_ms":134.606,"dependency_ms":56.266,"config_ms":56.733},"status":"discard","description":"Lazy Console/Panel creation in about and inspire commands","timestamp":1781313468952,"segment":0,"confidence":18.809142475809143,"asi":{"hypothesis":"Default about/inspire commands can register without constructing Rich Console or importing Panel until invoked.","rollback_reason":"Primary startup_ms regressed; Rich is already imported by base command/list paths so these lazy object changes do not help startup.","next_action_hint":"Target imports that appear in profile before command loading, especially usecli.__init__ top-level list/ui imports, not per-command Console construction."}}
{"run":21,"commit":"9cbc793","metric":56.942,"metrics":{"self_ms":134.297,"dependency_ms":56.674,"config_ms":56.942},"status":"discard","description":"Lazy import list_commands from usecli top-level only when listing/help is needed","timestamp":1781313486974,"segment":0,"confidence":21.3042328042328,"asi":{"hypothesis":"Avoid importing UI list rendering during version/normal startup paths by moving list_commands imports into help/listing branches.","rollback_reason":"Primary regressed; other imports still pull UI/list or measurement noise dominates, so this local laziness did not improve startup.","next_action_hint":"Profile after current kept changes before touching more UI imports; focus on measurable cumulative import chains."}}
{"run":22,"commit":"d76723a","metric":54.663,"metrics":{"self_ms":136.666,"dependency_ms":53.977,"config_ms":54.663},"status":"keep","description":"Lazy top-level UI exports from usecli module","timestamp":1781313529367,"segment":0,"confidence":20.987905548089888,"asi":{"hypothesis":"Project command modules commonly do `from usecli import BaseCommand`; they should not force import of Menu, params, Prompt/Confirm/Console, or console unless those symbols are requested.","result":"Large dependency startup improvement. Kept `from usecli import console/Menu/...` compatibility via module `__getattr__`; internal version/error printing now resolves console lazily."}}
{"run":23,"commit":"9b449fb","metric":54.278,"metrics":{"self_ms":134.74,"dependency_ms":54.209,"config_ms":54.278},"status":"keep","description":"Lazy Rich Console proxy in base_command","timestamp":1781313566704,"segment":0,"confidence":21.177526336324657,"asi":{"hypothesis":"Command modules import BaseCommand just to subclass/register; that should not require importing rich.console until custom help/group rendering actually prints.","result":"Small primary improvement with tests passing; maintained `base_command.console` patch compatibility using a lazy proxy object."}}
{"run":24,"commit":"9b449fb","metric":56.163,"metrics":{"self_ms":139.543,"dependency_ms":55.693,"config_ms":56.163},"status":"discard","description":"Defer title helper import from base_command until help formatting","timestamp":1781313599103,"segment":0,"confidence":21.992706645056725,"asi":{"hypothesis":"BaseCommand imports title utilities only to render custom help; normal command registration should not import title.py, importlib.metadata, tomllib, or Rich console.","rollback_reason":"Primary regressed significantly despite apparent profile opportunity; likely title import is pulled elsewhere anyway or lazy import changes perturb command registration overhead/noise.","next_action_hint":"If revisiting, inspect import graph after change to confirm title.py is actually avoided before benchmarking further."}}
{"run":25,"commit":"9b449fb","metric":56.84,"metrics":{"self_ms":137.788,"dependency_ms":56.358,"config_ms":56.84},"status":"discard","description":"Restrict usecli-only make/init skipping to package command directory","timestamp":1781313641083,"segment":0,"confidence":25.07066974595844,"asi":{"hypothesis":"The previous package-command skip should not accidentally skip downstream project commands located in a `make` directory; constrain it to usecli's own package command tree.","rollback_reason":"Primary regressed because per-file `path.resolve().is_relative_to(...)` added overhead.","next_action_hint":"Retry with a per-directory `is_package_directory = directory.resolve() == package_commands_dir` flag computed once, avoiding per-file resolve while preserving correctness."}}
{"run":26,"commit":"9b449fb","metric":54.744,"metrics":{"self_ms":135.599,"dependency_ms":54.487,"config_ms":54.744},"status":"discard","description":"Constrain usecli-only command skipping with per-directory package flag","timestamp":1781313665250,"segment":0,"confidence":30.527559055118072,"asi":{"hypothesis":"Compute whether the scanned directory is usecli's package command directory once, then skip init/make only there so downstream project commands in folders named `make` are still loaded.","rollback_reason":"Correctness improved but primary still regressed slightly versus best; need a zero-overhead way to thread package/default command context from load_commands.","next_action_hint":"Change `_load_from_dir` to accept `skip_usecli_only: bool = False` and pass it only for package command loading in non-usecli executions; tests patch call counts but should tolerate default parameter."}}
{"run":27,"commit":"9b449fb","metric":54.24,"metrics":{"self_ms":136.161,"dependency_ms":54.237,"config_ms":54.24},"status":"checks_failed","description":"Pass skip_usecli_only flag into package command directory loading","timestamp":1781313690037,"segment":0,"confidence":24.17728285077946,"asi":{"hypothesis":"Thread usecli-package context from load_commands to _load_from_dir to avoid per-file path checks and avoid skipping downstream project commands in `make` directories.","rollback_reason":"Metric improved, but tests mock `_load_from_dir` with a one-argument side effect and failed on the new keyword argument.","next_action_hint":"Retry without changing `_load_from_dir` call signature: set a private instance flag around the package load and have `_load_from_dir` read it, or add a wrapper method for package commands."}}
{"run":28,"commit":"41e380e","metric":55.093,"metrics":{"self_ms":135.527,"dependency_ms":55.093,"config_ms":54.439},"status":"keep","description":"Scope usecli-only command skipping to package load via private flag","timestamp":1781313714333,"segment":0,"confidence":23.645393160531505,"asi":{"hypothesis":"Avoid over-skipping downstream project commands in folders named `make` while preserving the fast path that skips usecli-only init/make package commands for non-usecli executables.","result":"Correctness fix for the command discovery constraint with a small primary regression versus the absolute best; kept because the prior optimization could fail to parse everything in a downstream commands folder, which violates the user objective."}}
{"run":29,"commit":"60b60ae","metric":54.786,"metrics":{"self_ms":136.735,"dependency_ms":54.621,"config_ms":54.786},"status":"keep","description":"Hoist skip_usecli_only flag to local in command scan loop","timestamp":1781313733524,"segment":0,"confidence":25.035977859778605,"asi":{"hypothesis":"After scoping usecli-only skips via an instance flag, copy it to a local before iterating command files to reduce per-file attribute lookup overhead.","result":"Recovered part of the correctness-fix regression while preserving downstream command-folder correctness."}}
{"run":30,"commit":"60b60ae","metric":54.889,"metrics":{"self_ms":136.122,"dependency_ms":54.555,"config_ms":54.889},"status":"discard","description":"Use generator prefilter for usecli-only package commands","timestamp":1781313752094,"segment":0,"confidence":25.375409069658726,"asi":{"hypothesis":"Avoid checking skip_usecli_only inside the main command import loop by wrapping package paths in a prefilter generator only when needed.","rollback_reason":"Primary regressed slightly; generator overhead outweighed branch removal.","next_action_hint":"Keep simple local-flag branch; pursue larger import reductions."}}
