{"run":31,"commit":"60b60ae","metric":55.504,"metrics":{"self_ms":138.443,"dependency_ms":55.107,"config_ms":55.504},"status":"discard","description":"Defer shutil import in usecli top-level until version output","timestamp":1781313778859,"segment":0,"confidence":25.578699340245052,"asi":{"hypothesis":"`shutil` is only needed for `--version` command path display, so defer it from module import.","rollback_reason":"Primary regressed; shutil import is not material or deferred import moved cost into the measured --version path.","next_action_hint":"Because benchmark includes --version self path, do not defer imports used by that path unless dependency/config paths benefit enough."}}
{"run":32,"commit":"60b60ae","metric":54.821,"metrics":{"self_ms":135.374,"dependency_ms":54.15,"config_ms":54.821},"status":"discard","description":"Cache parsed usecli.config.toml by mtime/size","timestamp":1781313810149,"segment":0,"confidence":26.00143712574843,"asi":{"hypothesis":"Config discovery parses usecli.config.toml for command matching and then parses it again during _load_config; cache by mtime/size to avoid duplicate TOML work in one process.","rollback_reason":"Primary regressed slightly; stat/resolve/cache overhead outweighed duplicate parse savings for small config files.","next_action_hint":"Avoid duplicate parse with an instance-local handoff from discovery to load rather than a generic global cache, or focus elsewhere."}}
{"run":33,"commit":"60b60ae","metric":55.614,"metrics":{"self_ms":101.162,"dependency_ms":53.98,"config_ms":55.614},"status":"discard","description":"Cache get_config when cwd is unchanged after startup import reductions","timestamp":1781313832785,"segment":0,"confidence":26.42551119766307,"asi":{"hypothesis":"Now that command imports are leaner, skipping repeated find_project_root calls for unchanged cwd may help without hurting dependency path.","rollback_reason":"Self startup improved dramatically, but primary worsened because config_ms regressed; primary benchmark still prioritizes dependency/config median.","next_action_hint":"This remains promising for self CLI startup. Revisit if benchmark weighting changes or combine with config path improvements that offset config_ms regression."}}
{"run":34,"commit":"60b60ae","metric":54.942,"metrics":{"self_ms":135.968,"dependency_ms":54.131,"config_ms":54.942},"status":"discard","description":"Defer theme config loading in colors module until COLOR attribute access","timestamp":1781313906218,"segment":0,"confidence":27.37165910237009,"asi":{"hypothesis":"Importing colors.py currently scans config/theme files immediately; initialize COLOR with defaults and load project theme only on first COLOR attribute access.","rollback_reason":"Dependency improved slightly but primary regressed due config/self tradeoff and likely delayed theme load in measured self --version path.","next_action_hint":"Theme laziness may be useful for command import-only workloads, but current benchmark includes color access; avoid unless paired with cheaper theme_context."}}
{"run":35,"commit":"60b60ae","metric":54.928,"metrics":{"self_ms":135.079,"dependency_ms":54.048,"config_ms":54.928},"status":"discard","description":"Lazy import importlib.metadata in colors config fallback paths","timestamp":1781313934976,"segment":0,"confidence":28.388075313807544,"asi":{"hypothesis":"colors.py imports importlib.metadata only for alias/package fallback; exact project config/theme loading should avoid that import.","rollback_reason":"Primary regressed; local import overhead/noise offset dependency gain and colors still performs config/theme work.","next_action_hint":"Do not micro-optimize colors metadata import alone; any colors improvement needs to reduce actual theme/config search cost."}}
{"run":36,"commit":"88103d8","metric":54.653,"metrics":{"self_ms":135.752,"dependency_ms":53.912,"config_ms":54.653},"status":"keep","description":"Skip reading packaged default theme TOML when defaults already match constants","timestamp":1781313965600,"segment":0,"confidence":28.145190562613433,"asi":{"hypothesis":"The packaged `default.toml` duplicates DEFAULT_THEME_COLORS; when resolving to that package default, avoid opening/parsing the TOML file and use constants directly.","result":"Small primary improvement, mostly on dependency path, while still allowing project/default theme overrides because only the package default path is skipped."}}
{"run":37,"commit":"88103d8","metric":54.744,"metrics":{"self_ms":137.529,"dependency_ms":53.968,"config_ms":54.744},"status":"discard","description":"Avoid resolve() when checking packaged default theme path","timestamp":1781313983823,"segment":0,"confidence":27.906426735218503,"asi":{"hypothesis":"THEMES_DIR and resolved theme path should already be comparable, so avoid per-startup resolve() for package default theme skip.","rollback_reason":"Primary regressed; path equality without resolve may miss equivalent paths or noise dominated.","next_action_hint":"Keep safer resolved comparison from previous kept change."}}
{"run":38,"commit":"88103d8","metric":55.124,"metrics":{"self_ms":136.814,"dependency_ms":53.997,"config_ms":55.124},"status":"discard","description":"Precompute resolved package default theme path","timestamp":1781314000827,"segment":0,"confidence":29.996131528046423,"asi":{"hypothesis":"Avoid constructing/resolving the packaged default theme path on each theme load by precomputing it at module import.","rollback_reason":"Primary regressed; moving resolve to import time did not help the measured startup mix.","next_action_hint":"Leave package default theme skip as-is; further color changes should reduce config search, not path constants."}}
{"run":39,"commit":"0092203","metric":54.452,"metrics":{"self_ms":135.612,"dependency_ms":54.426,"config_ms":54.452},"status":"keep","description":"Use parent-name check for package make command skip","timestamp":1781314022136,"segment":0,"confidence":32.4241338112306,"asi":{"hypothesis":"For usecli package commands, make-only modules live directly under a `make` parent directory, so `path.parent.name == \"make\"` avoids scanning all path parts while preserving scoped project-command correctness.","result":"Small primary improvement over current correct implementation."}}
{"run":40,"commit":"0092203","metric":54.802,"metrics":{"self_ms":136.138,"dependency_ms":54.135,"config_ms":54.802},"status":"discard","description":"Use parent-name check for internal command skip","timestamp":1781314038303,"segment":0,"confidence":33.30960417305921,"asi":{"hypothesis":"Internal command modules currently live directly under an `internal` parent, so parent-name comparison may be cheaper than scanning path.parts.","rollback_reason":"Primary regressed; path.parts membership was not a bottleneck or parent access cost/noise offset it.","next_action_hint":"Keep only the parent-name optimization for package make skip, which measured better."}}
{"run":41,"commit":"0092203","metric":55.223,"metrics":{"self_ms":136.573,"dependency_ms":54.747,"config_ms":55.223},"status":"discard","description":"Use os.path.basename instead of Path for command_name in load_commands","timestamp":1781314054598,"segment":0,"confidence":34.24479495268137,"asi":{"hypothesis":"Avoid constructing a Path object just to get argv[0] basename before package command loading.","rollback_reason":"Primary regressed; extra os import or noise outweighed any basename savings.","next_action_hint":"Do not add imports for tiny path micro-optimizations in command_service."}}
{"run":42,"commit":"0092203","metric":54.778,"metrics":{"self_ms":135.782,"dependency_ms":54.531,"config_ms":54.778},"status":"checks_failed","description":"Prefer top-level glob before recursive child scans for command files","timestamp":1781314082030,"segment":0,"confidence":36.550841750841855,"asi":{"hypothesis":"Many project commands are flat; scanning top-level *.py first and recursing only into child dirs may reduce Path.rglob overhead while still covering nested commands.","rollback_reason":"Tests explicitly expect directory.rglob('*.py') to be called on the provided directory mock; replacing it with glob/iterdir broke mocked behavior.","next_action_hint":"Avoid changing _load_from_dir traversal API unless tests are updated; rglob is part of tested behavior."}}
{"run":43,"commit":"0092203","metric":54.755,"metrics":{"self_ms":137.38,"dependency_ms":54.755,"config_ms":54.592},"status":"discard","description":"Remove runtime Protocol/final/cast usage from colors module","timestamp":1781314107375,"segment":0,"confidence":39.189891696750955,"asi":{"hypothesis":"colors.py startup can be reduced by avoiding Protocol class creation and final/cast runtime helpers used only for typing.","rollback_reason":"Primary regressed; typing helper removal did not improve measured import cost and reduces type clarity.","next_action_hint":"Leave colors typing structure intact; focus on I/O/config search rather than typing micro-optimizations."}}
{"run":44,"commit":"0092203","metric":54.371,"metrics":{"self_ms":138.347,"dependency_ms":54.334,"config_ms":54.371},"status":"discard","description":"Avoid sys.modules registration for dynamically loaded command files","timestamp":1781314144161,"segment":0,"confidence":47.654082528534126,"asi":{"hypothesis":"Skipping sys.modules insertion in _import_file reduces dynamic command import overhead.","rollback_reason":"Although primary improved, this is a hidden correctness risk: normal import machinery registers modules before exec, and decorators/dataclasses/recursive imports may rely on sys.modules during command module execution.","next_action_hint":"If revisiting, investigate safer unique module names or measure whether sys.modules assignment actually matters with dataclass command fixtures before keeping."}}
{"run":45,"commit":"0092203","metric":54.623,"metrics":{"self_ms":136.546,"dependency_ms":54.623,"config_ms":54.332},"status":"discard","description":"Restore previous sys.modules entry after command file exec","timestamp":1781314159720,"segment":0,"confidence":48.592658907788525,"asi":{"hypothesis":"Preserve normal during-exec sys.modules registration for correctness while avoiding permanent module-name collisions by restoring a previous entry after exec.","rollback_reason":"Primary regressed and adds complexity; not a startup win.","next_action_hint":"Leave sys.modules behavior unchanged unless addressing a correctness bug separately."}}
{"run":46,"commit":"0092203","metric":55.051,"metrics":{"self_ms":136.636,"dependency_ms":54.591,"config_ms":55.051},"status":"discard","description":"Return theme context from _load_theme to avoid duplicate import-time context scan","timestamp":1781314202817,"segment":0,"confidence":53.135584924131194,"asi":{"hypothesis":"colors.py calls _load_theme() and then _theme_context() at import, duplicating config/theme discovery; return the context from _load_theme and reuse it.","rollback_reason":"Primary regressed; although it removes duplicate-looking work, cache behavior or extra tuple handling did not improve measured startup.","next_action_hint":"Profile colors import specifically before restructuring theme context again."}}
{"run":47,"commit":"b0aadc5","metric":54.421,"metrics":{"self_ms":135.85,"dependency_ms":54.421,"config_ms":53.941},"status":"keep","description":"Lazy import json for editable direct_url config fallback","timestamp":1781314219206,"segment":0,"confidence":51.59505703422055,"asi":{"hypothesis":"ConfigManager imports json only to parse editable-install direct_url.json in rare package fallback paths; defer json from the common config startup path.","result":"Small primary improvement, mainly config_ms, with checks passing."}}
{"run":48,"commit":"b0aadc5","metric":54.625,"metrics":{"self_ms":136.382,"dependency_ms":53.656,"config_ms":54.625},"status":"discard","description":"Retry lazy importlib.metadata in ConfigManager after other import reductions","timestamp":1781314250546,"segment":0,"confidence":56.10129198966401,"asi":{"hypothesis":"With command_service metadata import already lazy, removing ConfigManager's top-level importlib.metadata may now reduce config_ms.","rollback_reason":"Primary regressed again; local fallback imports and/or noise offset top-level savings.","next_action_hint":"Keep ConfigManager metadata import top-level for now; lazy json was the useful manager import reduction."}}
{"run":49,"commit":"f3f17d5","metric":54.168,"metrics":{"self_ms":136.434,"dependency_ms":53.659,"config_ms":54.168},"status":"keep","description":"Use explicit None check after command file import","timestamp":1781314271655,"segment":0,"confidence":57.625531914893756,"asi":{"hypothesis":"_import_file returns ModuleType or None; checking `is None` avoids generic truthiness and is semantically tighter in the command loading loop.","result":"Small primary improvement with checks passing."}}
{"run":50,"commit":"f3f17d5","metric":54.29,"metrics":{"self_ms":135.956,"dependency_ms":53.592,"config_ms":54.29},"status":"discard","description":"Inline real-module command class loop instead of lambda predicate","timestamp":1781314295373,"segment":0,"confidence":60.89713322091026,"asi":{"hypothesis":"Avoid per-object lambda calls when scanning real module __dict__ values for BaseCommand subclasses.","rollback_reason":"Primary regressed; lambda predicate was not bottleneck or branch duplication hurt instruction/cache behavior.","next_action_hint":"Keep existing member loop; focus on larger import/config work."}}
{"run":51,"commit":"f3f17d5","metric":54.848,"metrics":{"self_ms":136.687,"dependency_ms":54.848,"config_ms":54.214},"status":"discard","description":"Remove runtime typing import from usecli top-level","timestamp":1781314311269,"segment":0,"confidence":64.94964028776954,"asi":{"hypothesis":"With future annotations, Any/Optional/Sequence are not needed at runtime in usecli.__init__, so remove typing import from startup.","rollback_reason":"Primary regressed; typing may already be imported by dependencies or noise dominates.","next_action_hint":"Avoid tiny typing-import removals unless profile shows they matter."}}
{"run":52,"commit":"8063f96","metric":53.465,"metrics":{"self_ms":147.94,"dependency_ms":53.465,"config_ms":52.688},"status":"keep","description":"Remove runtime typing import from base_command","timestamp":1781314334971,"segment":0,"confidence":64.84536082474168,"asi":{"hypothesis":"base_command is imported by every command module; with postponed annotations, TYPE_CHECKING/Any/ClassVar imports are unnecessary runtime overhead.","result":"Strong primary improvement on dependency/config mix, though self_ms worsened and should be monitored."}}
{"run":53,"commit":"8063f96","metric":53.633,"metrics":{"self_ms":140.213,"dependency_ms":52.389,"config_ms":53.633},"status":"discard","description":"Remove unused TYPE_CHECKING import from command_service","timestamp":1781314351317,"segment":0,"confidence":65.60122699386464,"asi":{"hypothesis":"command_service imports TYPE_CHECKING only for an empty pass block, so remove the typing import from a hot module.","rollback_reason":"Primary regressed despite dependency_ms improvement; config median worsened.","next_action_hint":"Typing removal helped base_command but not command_service; leave command_service structure unchanged."}}
{"run":54,"commit":"8063f96","metric":54.154,"metrics":{"self_ms":145.027,"dependency_ms":53.714,"config_ms":54.154},"status":"discard","description":"Remove runtime Any import from ConfigManager","timestamp":1781314371755,"segment":0,"confidence":65.76260762607608,"asi":{"hypothesis":"ConfigManager uses Any only in postponed annotations, so avoid importing typing in pure config startup.","rollback_reason":"Primary regressed; typing import removal did not help manager and may be hidden by other imports/noise.","next_action_hint":"Do not remove manager typing import without a clearer profile signal."}}
{"run":55,"commit":"8063f96","metric":54.09,"metrics":{"self_ms":103.287,"dependency_ms":54.09,"config_ms":54.045},"status":"discard","description":"Retry unchanged-cwd get_config cache after base_command typing removal","timestamp":1781314398713,"segment":0,"confidence":65.92478421701604,"asi":{"hypothesis":"The get_config cwd cache consistently helps self startup; with current leaner command imports it might also help primary enough.","rollback_reason":"Primary still worse than best, though self_ms improved by ~40ms. Config/dependency medians did not beat current best.","next_action_hint":"If user prioritizes `usecli --version`/self startup specifically, this cache is the strongest known secondary win; otherwise leave out."}}
{"run":56,"commit":"8063f96","metric":54.232,"metrics":{"self_ms":137.847,"dependency_ms":53.637,"config_ms":54.232},"status":"discard","description":"Retry deferring title import from base_command after typing removal","timestamp":1781314429229,"segment":0,"confidence":70.30243261012521,"asi":{"hypothesis":"Profile still shows base_command importing ui.title/Rich; after other changes, deferring title until help formatting may now help.","rollback_reason":"Primary still regressed; title deferral does not beat current best despite profile appearance.","next_action_hint":"Do not retry title deferral without a deeper import graph explanation."}}
{"run":57,"commit":"8063f96","metric":54.526,"metrics":{"self_ms":137.586,"dependency_ms":54.526,"config_ms":54.03},"status":"discard","description":"Lazy Rich Console proxy in title UI module","timestamp":1781314449327,"segment":0,"confidence":76.16096866096886,"asi":{"hypothesis":"ui.title is imported during startup for command help support but mostly needs config helpers, not Rich Console, until printing title.","rollback_reason":"Primary regressed; lazy proxy added overhead or Rich is imported elsewhere anyway.","next_action_hint":"Do not lazily proxy title console independently; base_command lazy console was the useful Rich-console change."}}
{"run":58,"commit":"8063f96","metric":54.491,"metrics":{"self_ms":137.536,"dependency_ms":53.919,"config_ms":54.491},"status":"discard","description":"Lazy import importlib.metadata in title fallback","timestamp":1781314479412,"segment":0,"confidence":77.82387190684162,"asi":{"hypothesis":"ui.title only needs package metadata in get_project_name fallback; defer importlib.metadata from module import.","rollback_reason":"Primary regressed; metadata is imported elsewhere in the startup path or local import overhead/noise outweighs savings.","next_action_hint":"Leave title metadata import as-is unless title.py is otherwise removed from startup."}}
{"run":59,"commit":"8063f96","metric":60.204,"metrics":{"self_ms":124.587,"dependency_ms":57.798,"config_ms":60.204},"status":"discard","description":"Share load_commands ConfigManager with _load_version to avoid duplicate get_config","timestamp":1781314526925,"segment":0,"confidence":76.16096866096886,"asi":{"hypothesis":"load_commands calls get_config after _load_version calls get_config; retrieving the config once and handing it to _load_version via a private attribute should avoid duplicate root/config discovery.","rollback_reason":"Primary regressed badly despite self_ms improvement; reordering get_config before version load and attribute plumbing worsened dependency/config paths.","next_action_hint":"Do not reorder load_commands around _load_version for this benchmark; if reducing duplicate get_config, find a lower-overhead cache that does not perturb dependency startup."}}
{"run":60,"commit":"8063f96","metric":54.245,"metrics":{"self_ms":137.708,"dependency_ms":53.544,"config_ms":54.245},"status":"discard","description":"Use ConfigManager overrides directly when building CLI help text","timestamp":1781314567990,"segment":0,"confidence":77.20577617328492,"asi":{"hypothesis":"_get_cli_help_text only needs to know whether top-level description/title/command_name were explicitly overridden; reading ConfigManager._overrides directly avoids multiple get()/has_key() traversals during Typer app construction.","rollback_reason":"Primary startup_ms regressed versus current best; private override lookup did not reduce the measured hot path enough and adds coupling to ConfigManager internals.","next_action_hint":"Avoid micro-optimizing help text access; target command import/config discovery work with clearer profile evidence."}}
{"run":61,"commit":"8063f96","metric":54.152,"metrics":{"self_ms":138.013,"dependency_ms":53.677,"config_ms":54.152},"status":"discard","description":"Reuse already-imported colors module instead of import_module in usecli top-level","timestamp":1781314594334,"segment":0,"confidence":77.71075581395402,"asi":{"hypothesis":"`from usecli.cli.config.colors import COLOR` already loads the colors module, so using sys.modules avoids an extra import_module call during top-level usecli startup.","rollback_reason":"Primary regressed versus current best despite removing a redundant-looking import lookup; effect is noise-level and not worth keeping.","next_action_hint":"Avoid tiny sys.modules/import_module micro-optimizations; focus on larger command/config import paths."}}
