{"run":62,"commit":"8063f96","metric":53.716,"metrics":{"self_ms":136.528,"dependency_ms":53.716,"config_ms":53.666},"status":"discard","description":"Lazy import styled exception classes in usecli top-level error paths","timestamp":1781314630102,"segment":0,"confidence":77.37337192474686,"asi":{"hypothesis":"Normal successful startup should not import UsecliBadParameter/UsecliUsageError and their exception modules; defer those imports into the rare error handlers.","rollback_reason":"Checks passed but primary startup_ms regressed versus current best; exception modules are either already imported through other paths or the saved import work is noise-level.","next_action_hint":"Do not pursue top-level exception import laziness further without profile evidence; focus on command/config discovery bottlenecks."}}
{"run":63,"commit":"8063f96","metric":55.153,"metrics":{"self_ms":137.586,"dependency_ms":53.49,"config_ms":55.153},"status":"discard","description":"Use string basename for argv command name in load_commands","timestamp":1781314654831,"segment":0,"confidence":77.71075581395402,"asi":{"hypothesis":"Avoid constructing a pathlib.Path object just to inspect argv[0] when deciding whether to skip usecli-only package commands for downstream CLIs, without adding an os import.","rollback_reason":"Primary regressed substantially because config_ms worsened; string manipulation did not help the hot path enough and may be noise.","next_action_hint":"Keep Path(sys.argv[0]).name; previous os.path.basename attempt also regressed, so argv basename extraction is not a useful target."}}
{"run":64,"commit":"8063f96","metric":56.877,"metrics":{"self_ms":136.954,"dependency_ms":53.664,"config_ms":56.877},"status":"discard","description":"Lazy import click Exit in CustomHelpCommand paths","timestamp":1781314707252,"segment":0,"confidence":76.4878397711014,"asi":{"hypothesis":"CustomHelpCommand only raises click.exceptions.Exit when interactive/help formatting paths run, so defer importing Exit from base_command module import.","rollback_reason":"Primary regressed badly via config_ms; click is already loaded through Typer/Click startup so removing this direct import offers no common-path benefit.","next_action_hint":"Do not target click exception imports; focus on imports that are not already pulled by Typer/Click."}}
{"run":65,"commit":"8063f96","metric":54.135,"metrics":{"self_ms":138.909,"dependency_ms":53.625,"config_ms":54.135},"status":"discard","description":"Remove redundant typer import from command_service","timestamp":1781314736866,"segment":0,"confidence":76.81752873563241,"asi":{"hypothesis":"`command_service.py` only uses `typer.Typer` in postponed annotations, and `usecli.__init__` already imports Typer; removing the redundant module import may reduce startup import overhead.","rollback_reason":"Checks passed but primary startup_ms regressed versus current best; import lookup is noise-level or self path worsened enough to offset tiny dependency/config changes.","next_action_hint":"Do not target redundant imports of modules already loaded by the startup path; look for genuinely avoidable imports or filesystem work."}}
{"run":66,"commit":"8063f96","metric":54.149,"metrics":{"self_ms":138.198,"dependency_ms":54.149,"config_ms":54.086},"status":"discard","description":"Fast-path ConfigManager project root when pyproject and usecli config are in cwd","timestamp":1781314772897,"segment":0,"confidence":73.94882434301532,"asi":{"hypothesis":"When both `pyproject.toml` and matching `usecli.config.toml` are directly in the start directory, ConfigManager can use that directory as project_root and skip an extra `find_project_root()` traversal.","rollback_reason":"Checks passed but primary regressed versus current best; added path comparisons/resolve overhead outweighed the skipped traversal in the representative workload.","next_action_hint":"Avoid adding generic ConfigManager fast paths with extra path checks unless profiling shows the saved traversal dominates."}}
{"run":67,"commit":"8063f96","metric":53.692,"metrics":{"self_ms":137.028,"dependency_ms":53.62,"config_ms":53.692},"status":"discard","description":"Lazy import random in inspire command handle","timestamp":1781314814773,"segment":0,"confidence":73.74482758620748,"asi":{"hypothesis":"The default inspire command is registered at startup but only needs `random` when invoked, so defer that import from the command module import path.","rollback_reason":"Checks passed but primary regressed versus current best; random import is too small/noisy relative to the startup path.","next_action_hint":"Do not pursue tiny standard-library imports in individual commands unless grouped with a broader command-module laziness strategy."}}
{"run":68,"commit":"8063f96","metric":54.163,"metrics":{"self_ms":137.722,"dependency_ms":53.723,"config_ms":54.163},"status":"discard","description":"Compute package commands directory once in load_commands","timestamp":1781314841405,"segment":0,"confidence":75.30281690140875,"asi":{"hypothesis":"`load_commands` resolves usecli's package command directory twice on direct-dependency runs; resolving it once and reusing it should reduce path overhead without changing command discovery semantics.","rollback_reason":"Checks passed but primary startup_ms regressed versus current best; duplicate path resolution is not a meaningful bottleneck in the representative workload.","next_action_hint":"Avoid path micro-optimizations in `load_commands`; look for larger import avoidance or filesystem traversal reductions."}}
{"run":69,"commit":"06bf04c","metric":53.155,"metrics":{"self_ms":138.023,"dependency_ms":53.104,"config_ms":53.155},"status":"keep","description":"Defer title.py, list.py, and exceptions from usecli startup by lazy-importing all title/list/exception paths simultaneously","timestamp":1781315218946,"segment":0,"confidence":76.5922190201734,"asi":{"hypothesis":"title.py is imported at startup through multiple independent paths (base_command, list.py via __init__, exceptions/usage.py, about_command, help_command). Deferring any single path doesn't avoid the import because the others still pull it in. Deferring ALL paths simultaneously avoids importing title.py and its heavy dependencies (importlib.metadata, tomllib, rich.console) during normal startup.","result":"New best primary metric. title.py is no longer imported during startup. Rich.console import is also deferred (only loaded via lazy Console proxy in base_command/about_command or on first actual print). Combined savings: ~0.02s title + ~0.02s rich.console + ~0.008s importlib.metadata + ~0.008s tomllib."}}
{"run":70,"commit":"318f981","metric":40.008,"metrics":{"self_ms":137.04,"dependency_ms":39.495,"config_ms":40.008},"status":"keep","description":"Defer rich.console import from utils.py and inspire_command.py command modules","timestamp":1781315355412,"segment":0,"confidence":58.70579603815147,"asi":{"hypothesis":"defaults/core/utils.py and defaults/base/inspire_command.py both import rich.console at module level and are loaded during command scanning even for non-usecli CLIs. Making their Console usage lazy avoids importing rich entirely during startup since no other path loads it.","result":"Dramatic 25% improvement. rich.console (~17ms) is no longer imported during startup. Combined with deferred title.py, the command scanning phase now avoids all heavy transitive imports."}}
{"run":71,"commit":"318f981","metric":41.251,"metrics":{"self_ms":141.433,"dependency_ms":41.251,"config_ms":40.161},"status":"discard","description":"Baseline measurement at current best commit","timestamp":1781315660784,"segment":0,"confidence":59.535714285714555,"asi":{"hypothesis":"Fresh baseline to confirm current state before next optimization attempt"}}
{"run":72,"commit":"2cfea61","metric":39.38,"metrics":{"self_ms":136.217,"dependency_ms":39.38,"config_ms":39.177},"status":"keep","description":"Defer colors.py _load_theme from module level to first COLOR attribute access","timestamp":1781315904266,"segment":0,"confidence":58.82001493652017,"asi":{"hypothesis":"colors.py calls _load_theme() and _theme_context() at module level, which walks the filesystem (~52ms in isolation). Deferring to first COLOR attribute access via _ColorMeta.__getattribute__ avoids this cost during startup.","result":"Small but real improvement (~1.6%). The colors import overlaps with other startup imports so the absolute savings is smaller than the isolated 52ms measurement."}}
{"run":73,"commit":"2cfea61","metric":39.85,"metrics":{"config_ms":39.85,"dependency_ms":39.545,"self_ms":138.647},"status":"discard","description":"Baseline measurement at colors.py lazy load commit","timestamp":1781316169628,"segment":0,"confidence":59.0404797601198,"asi":{"hypothesis":"Confirm current state after colors.py lazy load change"}}
{"run":74,"commit":"a7f591a","metric":38.437,"metrics":{"config_ms":38.213,"dependency_ms":38.437,"self_ms":135.882},"status":"keep","description":"Lazy import get_config and importlib.util in command_service","timestamp":1781316357022,"segment":0,"confidence":56.40058694057257,"asi":{"hypothesis":"command_service imports get_config from manager at module level, pulling in importlib.metadata/util and tomllib. Deferring to a wrapper function and moving importlib.util to _import_file avoids this during startup.","result":"~1ms improvement. Manager imports are now deferred until command loading actually runs."}}
{"run":75,"commit":"a7f591a","metric":40.038,"metrics":{"config_ms":40.038,"dependency_ms":39.186,"self_ms":128.213},"status":"discard","description":"Lazy config/__init__.py and cache aliases in _find_usecli_config_in_tree","timestamp":1781316852944,"segment":0,"confidence":55.225574712643834,"asi":{"hypothesis":"Lazy config/__init__.py to defer manager import, and cache console_script_aliases to avoid repeated distribution scanning","rollback_reason":"Primary regressed vs best 38.44ms; changes may be interfering with each other or causing other overhead","next_action_hint":"Revert config/__init__.py lazy change; try alias caching alone"}}
{"run":76,"commit":"a7f591a","metric":40.076,"metrics":{"config_ms":40.076,"dependency_ms":39.181,"self_ms":141.633},"status":"discard","description":"Cache console_script_aliases in _find_usecli_config_in_tree","timestamp":1781316883715,"segment":0,"confidence":54.36633663366358,"asi":{"hypothesis":"Cache _get_console_script_aliases in _find_usecli_config_in_tree to avoid repeated distribution scanning for noise configs","rollback_reason":"Primary regressed vs best 38.44ms; the alias caching itself doesn't save enough because _config_matches_command returns early for matching configs","next_action_hint":"Focus on deferring importlib.metadata import from manager.py module level"}}
{"run":77,"commit":"563d82d","metric":36.096,"metrics":{"config_ms":35.44,"dependency_ms":36.096,"self_ms":147.68},"status":"keep","description":"Defer importlib.metadata from manager.py module level + lazy tomllib/importlib.util in colors.py","timestamp":1781317046676,"segment":0,"confidence":49.719008264462865,"asi":{"hypothesis":"importlib.metadata (18ms) was being imported at module level in both colors.py and manager.py. Moving to local imports in the functions that need it defers this cost.","result":"~2.3ms improvement on primary. importlib.metadata is now imported lazily from manager.py._get_console_script_aliases when config discovery hits non-matching configs."}}
{"run":78,"commit":"c34c534","metric":34.655,"metrics":{"config_ms":34.655,"dependency_ms":34.436,"self_ms":143.672},"status":"keep","description":"Defer shutil import from __init__.py module level to run_app version callback","timestamp":1781317109965,"segment":0,"confidence":43.72870662460585,"asi":{"hypothesis":"shutil (3.8ms) was imported at module level but only used in run_app version callback. Deferring saves startup time.","result":"~1.4ms improvement on primary. shutil is now only imported when --version is passed."}}
{"run":79,"commit":"c34c534","metric":35.804,"metrics":{"config_ms":35.804,"dependency_ms":34.717,"self_ms":143.713},"status":"discard","description":"Cache console_script_aliases globally in ConfigManager","timestamp":1781317197917,"segment":0,"confidence":40.34342258440072,"asi":{"hypothesis":"Cache _get_console_script_aliases results to avoid repeated distribution scanning for non-matching configs","rollback_reason":"Primary regressed vs best 34.66ms; the first call still scans all distributions and caching adds overhead","next_action_hint":"Focus on avoiding the _get_console_script_aliases call entirely for the first config found"}}
{"run":80,"commit":"563d82d","metric":34.205,"metrics":{"config_ms":34.047,"dependency_ms":34.205,"self_ms":139.745},"status":"discard","description":"Baseline measurement at current best commit","timestamp":1781317354486,"segment":0,"confidence":36.51738672286625,"asi":{"hypothesis":"Confirm current state after deferred imports in colors.py, manager.py, and __init__.py"}}
{"run":81,"commit":"be6168b","metric":33.996,"metrics":{"config_ms":33.762,"dependency_ms":33.996,"self_ms":101.749},"status":"keep","description":"Fix get_config() cache invalidation by caching on cwd instead of project_root mismatch","timestamp":1781317711985,"segment":0,"confidence":33.07003891050588,"asi":{"hypothesis":"get_config() was creating ConfigManager twice because find_project_root() returned repo root while ConfigManager.project_root was src/usecli (where config file lives). Caching by cwd avoids the double instantiation.","result":"~0.2ms improvement on primary, but self_ms improved dramatically from 140ms to 102ms. Only 1 ConfigManager created now instead of 2."}}
{"run":82,"commit":"be6168b","metric":35.526,"metrics":{"config_ms":33.548,"dependency_ms":35.526,"self_ms":70.566},"status":"discard","description":"Lazy importlib.metadata in title.py + lazy exceptions/__init__.py + defer _get_cli_help_text","timestamp":1781318201016,"segment":0,"confidence":32.68846153846157,"asi":{"hypothesis":"importlib.metadata (6ms) was imported via title.py -> exceptions/__init__.py chain during startup. Making title.py and exceptions/__init__.py lazy avoids this.","rollback_reason":"Primary didn't improve (35.5ms vs 34.0ms best). self_ms improved massively (102ms->71ms) but primary is dominated by dependency/config scenarios.","next_action_hint":"The importlib.metadata chain was only relevant for self scenario. For dep/config scenarios, the config is found directly. Focus on the remaining import overhead in dep/config paths."}}
{"run":83,"commit":"ceef4a5","metric":33.234,"metrics":{"config_ms":33.185,"dependency_ms":33.234,"self_ms":80.318},"status":"keep","description":"Lazy importlib.metadata in title.py, lazy exceptions/__init__.py, defer help text, lazy usage.py console/COLOR","timestamp":1781318444239,"segment":0,"confidence":31.591254752851725,"asi":{"hypothesis":"Multiple lazy import changes: (1) title.py defers importlib.metadata and rich Console, (2) exceptions/__init__.py uses __getattr__, (3) usage.py defers Console/COLOR/title imports, (4) defer _get_cli_help_text from module level.","result":"~0.8ms improvement on primary (33.2ms vs 34.0ms). self_ms improved from 102ms to 80ms. importlib.metadata no longer imported during startup."}}
{"run":84,"commit":"ceef4a5","metric":33.575,"metrics":{"config_ms":33.494,"dependency_ms":33.575,"self_ms":72.068},"status":"discard","description":"Baseline measurement at current best","timestamp":1781318876343,"segment":0,"confidence":31.92507204610961,"asi":{"hypothesis":"Confirm current state - importlib.metadata not loaded, self_ms ~72ms"}}
{"run":85,"commit":"ceef4a5","metric":35.676,"metrics":{"config_ms":35.676,"dependency_ms":34.908,"self_ms":72.442},"status":"discard","description":"Baseline measurement confirming current state","timestamp":1781318998509,"segment":0,"confidence":32.26601941747592,"asi":{"hypothesis":"Confirm current state - importlib.metadata not loaded during startup"}}
{"run":86,"commit":"ceef4a5","metric":34.035,"metrics":{"config_ms":33.536,"dependency_ms":34.035,"self_ms":71.724},"status":"discard","description":"Baseline measurement at current best commit","timestamp":1781319091514,"segment":0,"confidence":29.967538322813397,"asi":{"hypothesis":"Confirm current state. Remaining: typer (~8ms), click (~6ms), typing (~4ms) are framework-level imports that are hard to avoid."}}
